{
  "schema_version": "0.1.0",
  "id": "adr-code-linkage-surface",
  "version": "0.1.0",
  "status": "experimental",
  "source_snapshot_refs": [
    {
      "id": "compiled-ir:test",
      "version": "0.1.0",
      "snapshot_hash": "sha256:aaaaaaaaaaaaaaaaaaaaaaaaaaaaaaaaaaaaaaaaaaaaaaaaaaaaaaaaaaaaaaaa"
    }
  ],
  "relationship_records": [
    {
      "id": "adr-code-link-001",
      "relationship_family": "adr_to_code",
      "from_ref": {
        "id": "decision:ADR-L-0031",
        "version": "1"
      },
      "to_ref": {
        "id": "code:ste-runtime:src/mcp/tools-context.ts",
        "version": "1"
      },
      "relationship_origin": "manual_mapping",
      "producer_ref": "fixture:mvc-evolution",
      "producer_kind": "manual",
      "generation_method": "curated_fixture",
      "provenance": {
        "source_ref": "fixture://mvc-evolution/linkage",
        "source_kind": "fixture"
      },
      "integrity": {
        "content_hash": "sha256:bbbbbbbbbbbbbbbbbbbbbbbbbbbbbbbbbbbbbbbbbbbbbbbbbbbbbbbbbbbbbbbb"
      }
    }
  ],
  "provenance": {
    "source_ref": "fixture://mvc-evolution/linkage-surface",
    "source_kind": "fixture"
  },
  "integrity": {
    "content_hash": "sha256:cccccccccccccccccccccccccccccccccccccccccccccccccccccccccccccccc"
  },
  "freshness": {
    "status": "current",
    "observed_at": "2026-05-30T00:00:00.000Z"
  },
  "confidence_or_validation_status": "candidate",
  "negative_space": []
}
